facility_id,facility_name,facility_level,ownership,subregion,longitude,latitude,strengthening_tier,strengthening_reason,priority_score,source_role,linked_spokes,linked_existing_nbs_spokes,linked_collocated_candidate_spokes,median_assigned_distance_km,max_assigned_distance_km,weak_or_long_routes,pct_weak_or_long_routes,route_risk_category,workload_category,hub_priority_flag,cl_binary,hu_binary,nbs_binary,tr_binary,hub_service_score,hub_service_deficit,hub_readiness,missing_specialised_followup_clinic,missing_hydroxyurea,missing_newborn_screening,missing_transfusion,nearby_weak_route_spokes,nearest_weak_route_spoke_distance_km,median_weak_route_spoke_distance_km,weak_route_spoke_names,current_assigned_hubs_for_nearby_spokes,missing_service_count,dominant_service_gap,missing_service_domains,coordinate_valid
HF0263,Butabika NATIONAL REFERAL HOSPITAL,NR Hospital,Government,KAMPALA,32.6561,0.315,tier_1_current_hub_strengthening,Current assigned hub has high route risk and partial SCD service readiness,5,current_assigned_hub,1,1,0,0,0,1,100,high_route_risk,low_spoke_load,partial_service_hub_with_route_risk,0,0,1,1,2,0.5,partial_hub_score_2,TRUE,TRUE,FALSE,FALSE,NA,NA,NA,NA,NA,2,specialised_scd_clinic_followup_gap,specialised_scd_clinic_followup; specialised_scd_clinic_followup; specialised_scd_clinic_followup; specialised_scd_clinic_followup; specialised_scd_clinic_followup; specialised_scd_clinic_followup; specialised_scd_clinic_followup; specialised_scd_clinic_followup; specialised_scd_clinic_followup; specialised_scd_clinic_followup; specialised_scd_clinic_followup; specialised_scd_clinic_followup; specialised_scd_clinic_followup; specialised_scd_clinic_followup; specialised_scd_clinic_followup; specialised_scd_clinic_followup; specialised_scd_clinic_followup; specialised_scd_clinic_followup; specialised_scd_clinic_followup; specialised_scd_clinic_followup; specialised_scd_clinic_followup; specialised_scd_clinic_followup; specialised_scd_clinic_followup; specialised_scd_clinic_followup; specialised_scd_clinic_followup; specialised_scd_clinic_followup; specialised_scd_clinic_followup; specialised_scd_clinic_followup; specialised_scd_clinic_followup; specialised_scd_clinic_followup; specialised_scd_clinic_followup; specialised_scd_clinic_followup; specialised_scd_clinic_followup; specialised_scd_clinic_followup; specialised_scd_clinic_followup; specialised_scd_clinic_followup; specialised_scd_clinic_followup; specialised_scd_clinic_followup; specialised_scd_clinic_followup; specialised_scd_clinic_followup; specialised_scd_clinic_followup; specialised_scd_clinic_followup; specialised_scd_clinic_followup; specialised_scd_clinic_followup; specialised_scd_clinic_followup; specialised_scd_clinic_followup; specialised_scd_clinic_followup; specialised_scd_clinic_followup; specialised_scd_clinic_followup; specialised_scd_clinic_followup; specialised_scd_clinic_followup; specialised_scd_clinic_followup; specialised_scd_clinic_followup; specialised_scd_clinic_followup; specialised_scd_clinic_followup; specialised_scd_clinic_followup; specialised_scd_clinic_followup; specialised_scd_clinic_followup; specialised_scd_clinic_followup; specialised_scd_clinic_followup; specialised_scd_clinic_followup; specialised_scd_clinic_followup; specialised_scd_clinic_followup; specialised_scd_clinic_followup; specialised_scd_clinic_followup; specialised_scd_clinic_followup; specialised_scd_clinic_followup; specialised_scd_clinic_followup; specialised_scd_clinic_followup; specialised_scd_clinic_followup; specialised_scd_clinic_followup; specialised_scd_clinic_followup; specialised_scd_clinic_followup; specialised_scd_clinic_followup; specialised_scd_clinic_followup; specialised_scd_clinic_followup; specialised_scd_clinic_followup; specialised_scd_clinic_followup; specialised_scd_clinic_followup; specialised_scd_clinic_followup; specialised_scd_clinic_followup; specialised_scd_clinic_followup; specialised_scd_clinic_followup; specialised_scd_clinic_followup; specialised_scd_clinic_followup; specialised_scd_clinic_followup; specialised_scd_clinic_followup; specialised_scd_clinic_followup; specialised_scd_clinic_followup; hydroxyurea; hydroxyurea; hydroxyurea; hydroxyurea; hydroxyurea; hydroxyurea; hydroxyurea; hydroxyurea; hydroxyurea; hydroxyurea; hydroxyurea; hydroxyurea; hydroxyurea; hydroxyurea; hydroxyurea; hydroxyurea; hydroxyurea; hydroxyurea; hydroxyurea; hydroxyurea; hydroxyurea; hydroxyurea; hydroxyurea; hydroxyurea; hydroxyurea; hydroxyurea; hydroxyurea; hydroxyurea; hydroxyurea; hydroxyurea; hydroxyurea; hydroxyurea; hydroxyurea; hydroxyurea; hydroxyurea; hydroxyurea; hydroxyurea; hydroxyurea; hydroxyurea; hydroxyurea; hydroxyurea; hydroxyurea; hydroxyurea; hydroxyurea; hydroxyurea; hydroxyurea; hydroxyurea; hydroxyurea; hydroxyurea; hydroxyurea; hydroxyurea; hydroxyurea; hydroxyurea; hydroxyurea; hydroxyurea; hydroxyurea; hydroxyurea; hydroxyurea; hydroxyurea; hydroxyurea; hydroxyurea; hydroxyurea; hydroxyurea; hydroxyurea; hydroxyurea; hydroxyurea; hydroxyurea; hydroxyurea; hydroxyurea; hydroxyurea; hydroxyurea; hydroxyurea; hydroxyurea; hydroxyurea; hydroxyurea; hydroxyurea; hydroxyurea; hydroxyurea; hydroxyurea; hydroxyurea; hydroxyurea; hydroxyurea; hydroxyurea; hydroxyurea; hydroxyurea; hydroxyurea; hydroxyurea; hydroxyurea; hydroxyurea; hydroxyurea; hydroxyurea; hydroxyurea; hydroxyurea; hydroxyurea; hydroxyurea; hydroxyurea; hydroxyurea; hydroxyurea; hydroxyurea; hydroxyurea; hydroxyurea; hydroxyurea; hydroxyurea; hydroxyurea; hydroxyurea; hydroxyurea; hydroxyurea; hydroxyurea; hydroxyurea; hydroxyurea; hydroxyurea; hydroxyurea; hydroxyurea; hydroxyurea; hydroxyurea; hydroxyurea; hydroxyurea; hydroxyurea; hydroxyurea; hydroxyurea; newborn_screening; newborn_screening; newborn_screening; newborn_screening; newborn_screening; newborn_screening; newborn_screening; newborn_screening; newborn_screening; newborn_screening; newborn_screening; newborn_screening; newborn_screening; newborn_screening; newborn_screening; newborn_screening; newborn_screening; newborn_screening; newborn_screening; newborn_screening; newborn_screening; newborn_screening; newborn_screening; newborn_screening; newborn_screening; newborn_screening; newborn_screening; newborn_screening; newborn_screening; newborn_screening; newborn_screening; newborn_screening; newborn_screening; newborn_screening; newborn_screening; newborn_screening; newborn_screening; newborn_screening; newborn_screening; newborn_screening; newborn_screening; newborn_screening; newborn_screening; newborn_screening; newborn_screening; newborn_screening; newborn_screening; newborn_screening; newborn_screening; newborn_screening; newborn_screening; newborn_screening; newborn_screening; newborn_screening; newborn_screening; newborn_screening; newborn_screening; newborn_screening; newborn_screening; newborn_screening; newborn_screening; newborn_screening; newborn_screening; newborn_screening; newborn_screening; newborn_screening; newborn_screening; newborn_screening; newborn_screening; newborn_screening; newborn_screening; newborn_screening; newborn_screening; newborn_screening; newborn_screening; newborn_screening; newborn_screening; newborn_screening; newborn_screening; newborn_screening; newborn_screening; newborn_screening; newborn_screening; newborn_screening; newborn_screening; newborn_screening; newborn_screening; newborn_screening; newborn_screening; newborn_screening; newborn_screening; newborn_screening; newborn_screening; newborn_screening; newborn_screening; newborn_screening; newborn_screening; newborn_screening; newborn_screening; newborn_screening; newborn_screening; newborn_screening; newborn_screening; newborn_screening; newborn_screening; newborn_screening; newborn_screening; newborn_screening; newborn_screening; newborn_screening; transfusion; transfusion; transfusion; transfusion; transfusion; transfusion; transfusion; transfusion; transfusion; transfusion; transfusion; transfusion; transfusion; transfusion; transfusion; transfusion; transfusion; transfusion; transfusion; transfusion; transfusion; transfusion; transfusion; transfusion; transfusion; transfusion; transfusion; transfusion; transfusion; transfusion; transfusion; transfusion; transfusion; transfusion; transfusion; transfusion; transfusion; transfusion; transfusion; transfusion; transfusion; transfusion; transfusion; transfusion; transfusion; transfusion; transfusion; transfusion; transfusion; transfusion; transfusion; transfusion; transfusion; transfusion; transfusion; transfusion; transfusion; transfusion; transfusion; transfusion; transfusion; transfusion; transfusion; transfusion; transfusion; transfusion; transfusion; transfusion; transfusion; transfusion; transfusion; transfusion; transfusion; transfusion; transfusion; transfusion; transfusion; transfusion; transfusion; transfusion; transfusion; transfusion; transfusion,TRUE
HF2594,Ibanda HOSPITAL,General Hospital,Private Not For Profit,ANKOLE,30.44786,-0.13048,tier_1_current_hub_strengthening,Current assigned hub has high route risk and partial SCD service readiness,5,current_assigned_hub,1,1,0,41,41,1,100,high_route_risk,low_spoke_load,partial_service_hub_with_route_risk,0,0,1,1,2,0.5,partial_hub_score_2,TRUE,TRUE,FALSE,FALSE,NA,NA,NA,NA,NA,2,specialised_scd_clinic_followup_gap,specialised_scd_clinic_followup; specialised_scd_clinic_followup; specialised_scd_clinic_followup; specialised_scd_clinic_followup; specialised_scd_clinic_followup; specialised_scd_clinic_followup; specialised_scd_clinic_followup; specialised_scd_clinic_followup; specialised_scd_clinic_followup; specialised_scd_clinic_followup; specialised_scd_clinic_followup; specialised_scd_clinic_followup; specialised_scd_clinic_followup; specialised_scd_clinic_followup; specialised_scd_clinic_followup; specialised_scd_clinic_followup; specialised_scd_clinic_followup; specialised_scd_clinic_followup; specialised_scd_clinic_followup; specialised_scd_clinic_followup; specialised_scd_clinic_followup; specialised_scd_clinic_followup; specialised_scd_clinic_followup; specialised_scd_clinic_followup; specialised_scd_clinic_followup; specialised_scd_clinic_followup; specialised_scd_clinic_followup; specialised_scd_clinic_followup; specialised_scd_clinic_followup; specialised_scd_clinic_followup; specialised_scd_clinic_followup; specialised_scd_clinic_followup; specialised_scd_clinic_followup; specialised_scd_clinic_followup; specialised_scd_clinic_followup; specialised_scd_clinic_followup; specialised_scd_clinic_followup; specialised_scd_clinic_followup; specialised_scd_clinic_followup; specialised_scd_clinic_followup; specialised_scd_clinic_followup; specialised_scd_clinic_followup; specialised_scd_clinic_followup; specialised_scd_clinic_followup; specialised_scd_clinic_followup; specialised_scd_clinic_followup; specialised_scd_clinic_followup; specialised_scd_clinic_followup; specialised_scd_clinic_followup; specialised_scd_clinic_followup; specialised_scd_clinic_followup; specialised_scd_clinic_followup; specialised_scd_clinic_followup; specialised_scd_clinic_followup; specialised_scd_clinic_followup; specialised_scd_clinic_followup; specialised_scd_clinic_followup; specialised_scd_clinic_followup; specialised_scd_clinic_followup; specialised_scd_clinic_followup; specialised_scd_clinic_followup; specialised_scd_clinic_followup; specialised_scd_clinic_followup; specialised_scd_clinic_followup; specialised_scd_clinic_followup; specialised_scd_clinic_followup; specialised_scd_clinic_followup; specialised_scd_clinic_followup; specialised_scd_clinic_followup; specialised_scd_clinic_followup; specialised_scd_clinic_followup; specialised_scd_clinic_followup; specialised_scd_clinic_followup; specialised_scd_clinic_followup; specialised_scd_clinic_followup; specialised_scd_clinic_followup; specialised_scd_clinic_followup; specialised_scd_clinic_followup; specialised_scd_clinic_followup; specialised_scd_clinic_followup; specialised_scd_clinic_followup; specialised_scd_clinic_followup; specialised_scd_clinic_followup; specialised_scd_clinic_followup; specialised_scd_clinic_followup; specialised_scd_clinic_followup; specialised_scd_clinic_followup; specialised_scd_clinic_followup; specialised_scd_clinic_followup; hydroxyurea; hydroxyurea; hydroxyurea; hydroxyurea; hydroxyurea; hydroxyurea; hydroxyurea; hydroxyurea; hydroxyurea; hydroxyurea; hydroxyurea; hydroxyurea; hydroxyurea; hydroxyurea; hydroxyurea; hydroxyurea; hydroxyurea; hydroxyurea; hydroxyurea; hydroxyurea; hydroxyurea; hydroxyurea; hydroxyurea; hydroxyurea; hydroxyurea; hydroxyurea; hydroxyurea; hydroxyurea; hydroxyurea; hydroxyurea; hydroxyurea; hydroxyurea; hydroxyurea; hydroxyurea; hydroxyurea; hydroxyurea; hydroxyurea; hydroxyurea; hydroxyurea; hydroxyurea; hydroxyurea; hydroxyurea; hydroxyurea; hydroxyurea; hydroxyurea; hydroxyurea; hydroxyurea; hydroxyurea; hydroxyurea; hydroxyurea; hydroxyurea; hydroxyurea; hydroxyurea; hydroxyurea; hydroxyurea; hydroxyurea; hydroxyurea; hydroxyurea; hydroxyurea; hydroxyurea; hydroxyurea; hydroxyurea; hydroxyurea; hydroxyurea; hydroxyurea; hydroxyurea; hydroxyurea; hydroxyurea; hydroxyurea; hydroxyurea; hydroxyurea; hydroxyurea; hydroxyurea; hydroxyurea; hydroxyurea; hydroxyurea; hydroxyurea; hydroxyurea; hydroxyurea; hydroxyurea; hydroxyurea; hydroxyurea; hydroxyurea; hydroxyurea; hydroxyurea; hydroxyurea; hydroxyurea; hydroxyurea; hydroxyurea; hydroxyurea; hydroxyurea; hydroxyurea; hydroxyurea; hydroxyurea; hydroxyurea; hydroxyurea; hydroxyurea; hydroxyurea; hydroxyurea; hydroxyurea; hydroxyurea; hydroxyurea; hydroxyurea; hydroxyurea; hydroxyurea; hydroxyurea; hydroxyurea; hydroxyurea; hydroxyurea; hydroxyurea; hydroxyurea; hydroxyurea; hydroxyurea; hydroxyurea; hydroxyurea; hydroxyurea; hydroxyurea; hydroxyurea; hydroxyurea; hydroxyurea; newborn_screening; newborn_screening; newborn_screening; newborn_screening; newborn_screening; newborn_screening; newborn_screening; newborn_screening; newborn_screening; newborn_screening; newborn_screening; newborn_screening; newborn_screening; newborn_screening; newborn_screening; newborn_screening; newborn_screening; newborn_screening; newborn_screening; newborn_screening; newborn_screening; newborn_screening; newborn_screening; newborn_screening; newborn_screening; newborn_screening; newborn_screening; newborn_screening; newborn_screening; newborn_screening; newborn_screening; newborn_screening; newborn_screening; newborn_screening; newborn_screening; newborn_screening; newborn_screening; newborn_screening; newborn_screening; newborn_screening; newborn_screening; newborn_screening; newborn_screening; newborn_screening; newborn_screening; newborn_screening; newborn_screening; newborn_screening; newborn_screening; newborn_screening; newborn_screening; newborn_screening; newborn_screening; newborn_screening; newborn_screening; newborn_screening; newborn_screening; newborn_screening; newborn_screening; newborn_screening; newborn_screening; newborn_screening; newborn_screening; newborn_screening; newborn_screening; newborn_screening; newborn_screening; newborn_screening; newborn_screening; newborn_screening; newborn_screening; newborn_screening; newborn_screening; newborn_screening; newborn_screening; newborn_screening; newborn_screening; newborn_screening; newborn_screening; newborn_screening; newborn_screening; newborn_screening; newborn_screening; newborn_screening; newborn_screening; newborn_screening; newborn_screening; newborn_screening; newborn_screening; newborn_screening; newborn_screening; newborn_screening; newborn_screening; newborn_screening; newborn_screening; newborn_screening; newborn_screening; newborn_screening; newborn_screening; newborn_screening; newborn_screening; newborn_screening; newborn_screening; newborn_screening; newborn_screening; newborn_screening; newborn_screening; newborn_screening; newborn_screening; newborn_screening; transfusion; transfusion; transfusion; transfusion; transfusion; transfusion; transfusion; transfusion; transfusion; transfusion; transfusion; transfusion; transfusion; transfusion; transfusion; transfusion; transfusion; transfusion; transfusion; transfusion; transfusion; transfusion; transfusion; transfusion; transfusion; transfusion; transfusion; transfusion; transfusion; transfusion; transfusion; transfusion; transfusion; transfusion; transfusion; transfusion; transfusion; transfusion; transfusion; transfusion; transfusion; transfusion; transfusion; transfusion; transfusion; transfusion; transfusion; transfusion; transfusion; transfusion; transfusion; transfusion; transfusion; transfusion; transfusion; transfusion; transfusion; transfusion; transfusion; transfusion; transfusion; transfusion; transfusion; transfusion; transfusion; transfusion; transfusion; transfusion; transfusion; transfusion; transfusion; transfusion; transfusion; transfusion; transfusion; transfusion; transfusion; transfusion; transfusion; transfusion; transfusion; transfusion; transfusion,TRUE
HF2927,Kagadi HOSPITAL,General Hospital,Government,BUNYORO,30.808823,0.94473,tier_1_current_hub_strengthening,Current assigned hub has high route risk,5,current_assigned_hub,1,1,0,52.7,52.7,1,100,high_route_risk,low_spoke_load,high_route_risk_hub,1,1,1,1,4,0,full_hub_score_4,FALSE,FALSE,FALSE,FALSE,NA,NA,NA,NA,NA,0,no_major_gap,specialised_scd_clinic_followup; specialised_scd_clinic_followup; specialised_scd_clinic_followup; specialised_scd_clinic_followup; specialised_scd_clinic_followup; specialised_scd_clinic_followup; specialised_scd_clinic_followup; specialised_scd_clinic_followup; specialised_scd_clinic_followup; specialised_scd_clinic_followup; specialised_scd_clinic_followup; specialised_scd_clinic_followup; specialised_scd_clinic_followup; specialised_scd_clinic_followup; specialised_scd_clinic_followup; specialised_scd_clinic_followup; specialised_scd_clinic_followup; specialised_scd_clinic_followup; specialised_scd_clinic_followup; specialised_scd_clinic_followup; specialised_scd_clinic_followup; specialised_scd_clinic_followup; specialised_scd_clinic_followup; specialised_scd_clinic_followup; specialised_scd_clinic_followup; specialised_scd_clinic_followup; specialised_scd_clinic_followup; specialised_scd_clinic_followup; specialised_scd_clinic_followup; specialised_scd_clinic_followup; specialised_scd_clinic_followup; specialised_scd_clinic_followup; specialised_scd_clinic_followup; specialised_scd_clinic_followup; specialised_scd_clinic_followup; specialised_scd_clinic_followup; specialised_scd_clinic_followup; specialised_scd_clinic_followup; specialised_scd_clinic_followup; specialised_scd_clinic_followup; specialised_scd_clinic_followup; specialised_scd_clinic_followup; specialised_scd_clinic_followup; specialised_scd_clinic_followup; specialised_scd_clinic_followup; specialised_scd_clinic_followup; specialised_scd_clinic_followup; specialised_scd_clinic_followup; specialised_scd_clinic_followup; specialised_scd_clinic_followup; specialised_scd_clinic_followup; specialised_scd_clinic_followup; specialised_scd_clinic_followup; specialised_scd_clinic_followup; specialised_scd_clinic_followup; specialised_scd_clinic_followup; specialised_scd_clinic_followup; specialised_scd_clinic_followup; specialised_scd_clinic_followup; specialised_scd_clinic_followup; specialised_scd_clinic_followup; specialised_scd_clinic_followup; specialised_scd_clinic_followup; specialised_scd_clinic_followup; specialised_scd_clinic_followup; specialised_scd_clinic_followup; specialised_scd_clinic_followup; specialised_scd_clinic_followup; specialised_scd_clinic_followup; specialised_scd_clinic_followup; specialised_scd_clinic_followup; specialised_scd_clinic_followup; specialised_scd_clinic_followup; specialised_scd_clinic_followup; specialised_scd_clinic_followup; specialised_scd_clinic_followup; specialised_scd_clinic_followup; specialised_scd_clinic_followup; specialised_scd_clinic_followup; specialised_scd_clinic_followup; specialised_scd_clinic_followup; specialised_scd_clinic_followup; specialised_scd_clinic_followup; specialised_scd_clinic_followup; specialised_scd_clinic_followup; specialised_scd_clinic_followup; specialised_scd_clinic_followup; specialised_scd_clinic_followup; specialised_scd_clinic_followup; hydroxyurea; hydroxyurea; hydroxyurea; hydroxyurea; hydroxyurea; hydroxyurea; hydroxyurea; hydroxyurea; hydroxyurea; hydroxyurea; hydroxyurea; hydroxyurea; hydroxyurea; hydroxyurea; hydroxyurea; hydroxyurea; hydroxyurea; hydroxyurea; hydroxyurea; hydroxyurea; hydroxyurea; hydroxyurea; hydroxyurea; hydroxyurea; hydroxyurea; hydroxyurea; hydroxyurea; hydroxyurea; hydroxyurea; hydroxyurea; hydroxyurea; hydroxyurea; hydroxyurea; hydroxyurea; hydroxyurea; hydroxyurea; hydroxyurea; hydroxyurea; hydroxyurea; hydroxyurea; hydroxyurea; hydroxyurea; hydroxyurea; hydroxyurea; hydroxyurea; hydroxyurea; hydroxyurea; hydroxyurea; hydroxyurea; hydroxyurea; hydroxyurea; hydroxyurea; hydroxyurea; hydroxyurea; hydroxyurea; hydroxyurea; hydroxyurea; hydroxyurea; hydroxyurea; hydroxyurea; hydroxyurea; hydroxyurea; hydroxyurea; hydroxyurea; hydroxyurea; hydroxyurea; hydroxyurea; hydroxyurea; hydroxyurea; hydroxyurea; hydroxyurea; hydroxyurea; hydroxyurea; hydroxyurea; hydroxyurea; hydroxyurea; hydroxyurea; hydroxyurea; hydroxyurea; hydroxyurea; hydroxyurea; hydroxyurea; hydroxyurea; hydroxyurea; hydroxyurea; hydroxyurea; hydroxyurea; hydroxyurea; hydroxyurea; hydroxyurea; hydroxyurea; hydroxyurea; hydroxyurea; hydroxyurea; hydroxyurea; hydroxyurea; hydroxyurea; hydroxyurea; hydroxyurea; hydroxyurea; hydroxyurea; hydroxyurea; hydroxyurea; hydroxyurea; hydroxyurea; hydroxyurea; hydroxyurea; hydroxyurea; hydroxyurea; hydroxyurea; hydroxyurea; hydroxyurea; hydroxyurea; hydroxyurea; hydroxyurea; hydroxyurea; hydroxyurea; hydroxyurea; hydroxyurea; hydroxyurea; newborn_screening; newborn_screening; newborn_screening; newborn_screening; newborn_screening; newborn_screening; newborn_screening; newborn_screening; newborn_screening; newborn_screening; newborn_screening; newborn_screening; newborn_screening; newborn_screening; newborn_screening; newborn_screening; newborn_screening; newborn_screening; newborn_screening; newborn_screening; newborn_screening; newborn_screening; newborn_screening; newborn_screening; newborn_screening; newborn_screening; newborn_screening; newborn_screening; newborn_screening; newborn_screening; newborn_screening; newborn_screening; newborn_screening; newborn_screening; newborn_screening; newborn_screening; newborn_screening; newborn_screening; newborn_screening; newborn_screening; newborn_screening; newborn_screening; newborn_screening; newborn_screening; newborn_screening; newborn_screening; newborn_screening; newborn_screening; newborn_screening; newborn_screening; newborn_screening; newborn_screening; newborn_screening; newborn_screening; newborn_screening; newborn_screening; newborn_screening; newborn_screening; newborn_screening; newborn_screening; newborn_screening; newborn_screening; newborn_screening; newborn_screening; newborn_screening; newborn_screening; newborn_screening; newborn_screening; newborn_screening; newborn_screening; newborn_screening; newborn_screening; newborn_screening; newborn_screening; newborn_screening; newborn_screening; newborn_screening; newborn_screening; newborn_screening; newborn_screening; newborn_screening; newborn_screening; newborn_screening; newborn_screening; newborn_screening; newborn_screening; newborn_screening; newborn_screening; newborn_screening; newborn_screening; newborn_screening; newborn_screening; newborn_screening; newborn_screening; newborn_screening; newborn_screening; newborn_screening; newborn_screening; newborn_screening; newborn_screening; newborn_screening; newborn_screening; newborn_screening; newborn_screening; newborn_screening; newborn_screening; newborn_screening; newborn_screening; newborn_screening; newborn_screening; transfusion; transfusion; transfusion; transfusion; transfusion; transfusion; transfusion; transfusion; transfusion; transfusion; transfusion; transfusion; transfusion; transfusion; transfusion; transfusion; transfusion; transfusion; transfusion; transfusion; transfusion; transfusion; transfusion; transfusion; transfusion; transfusion; transfusion; transfusion; transfusion; transfusion; transfusion; transfusion; transfusion; transfusion; transfusion; transfusion; transfusion; transfusion; transfusion; transfusion; transfusion; transfusion; transfusion; transfusion; transfusion; transfusion; transfusion; transfusion; transfusion; transfusion; transfusion; transfusion; transfusion; transfusion; transfusion; transfusion; transfusion; transfusion; transfusion; transfusion; transfusion; transfusion; transfusion; transfusion; transfusion; transfusion; transfusion; transfusion; transfusion; transfusion; transfusion; transfusion; transfusion; transfusion; transfusion; transfusion; transfusion; transfusion; transfusion; transfusion; transfusion; transfusion; transfusion,TRUE
